{
  "record": "certificate",
  "key": "host.install_peer.peer-lead-host-1.1",
  "writer": {
    "type": "authority",
    "installation": "install_peer",
    "key_id": "test-peer-authority-key-1"
  },
  "sequence": 1,
  "issued_at": "2026-10-22T00:00:00.000Z",
  "expires_at": "2026-11-21T00:00:00.000Z",
  "body": {
    "certificate_id": "cert_peer_lead_host_1",
    "installation": "install_peer",
    "runtime": "peer-lead-host-1",
    "teams": [
      "team_peer"
    ],
    "roles": [
      "lead_host",
      "team_services"
    ],
    "membership_epoch": 1,
    "revocation_epoch": 0,
    "application_key": {
      "key_id": "test-peer-lead-key-1",
      "public_key": "dSnEVtk40rj-kPpsz5FtNGdwpkvLt7UyO2h6zeIM0Aw"
    },
    "nats_public_key": "UPPPPPPPPPPPPPPPPPPPPPPPPPPPPPPPPPPPPPPPPPPPPPPPPPPPPPPP",
    "agent_types": [
      "team_lead"
    ],
    "session_limit": 4,
    "protocol": "1.0-pre",
    "deployment": "local",
    "profile_sha256": "CgoKCgoKCgoKCgoKCgoKCgoKCgoKCgoKCgoKCgoKCgo",
    "software": {
      "name": "universal-agents",
      "version": "0.10.0"
    },
    "issued_at": "2026-10-22T00:00:00.000Z",
    "expires_at": "2026-11-21T00:00:00.000Z"
  },
  "algorithm": "ed25519",
  "body_digest": "HBFyCv9dqLbwAtTo96pLMi2FcJB3YuEwpq8mi03Y6Mc",
  "signature": "KuQKXfBXCQYIOKxYFGd1_n0m7BofKWlRX-z1xiE3CGAcxRh5I4wY_ny3-9fuzSshc6wcGO7dzFM0ATUIM9BdAg"
}
